{
  "title": "Finding the Right Co-Founder: Building Trust and Dividing Responsibilities",
  "description": "A conversation with aura co-founders about choosing the right partner when starting a business and the importance of trust in co-founder relationships.",
  "summary": "In this episode of Founder Facing, the host interviews Gautam Madon (CTO) and Purvi Goel (CEO) of aura, a company building autonomous HR solutions. They discuss how they divide responsibilities as co-founders, their approach to trust and communication, their experience hiring their first employee, and their sales and marketing strategies as an early-stage startup.",
  "keyTopics": [
    "Importance of trust in co-founder relationships",
    "Building autonomous HR solutions with AI",
    "Splitting responsibilities between co-founders",
    "Strategies for making your first startup hire",
    "Sales approaches for early-stage startups",
    "Marketing and partnership strategies for B2B companies"
  ],
  "guest": "Gautam Madon and Purvi Goel",
  "guestTitle": "CTO and CEO of aura",
  "duration": "45 min",
  "publishDate": "2025-05-21T00:00:00Z",
  "spotifyEmbedUrl": "https://open.spotify.com/embed/episode/2jvm94zbltWRhnmTDjJ9uf?utm_source=generator&theme=0",
  "pullQuotes": [
    {
      "quote": "Tesla's doing auto pilot for cars. We are trying to do the same for HR.",
      "attribution": "Gautam Madon"
    },
    {
      "quote": "Trust is most important. Adding to trust. Maybe the other thing would be just EQ, your emotional quotient, right? It's a long journey.",
      "attribution": "Purvi Goel"
    },
    {
      "quote": "Sales is the most important thing that can really make your company and scale it or basically kill it.",
      "attribution": "Purvi Goel"
    }
  ],
  "resourcesMentioned": [
    {
      "title": "Challenger Sale",
      "url": "https://www.amazon.com/Challenger-Sale-Control-Customer-Conversation/dp/1591844355",
      "description": "Book on sales techniques recommended by an investor"
    },
    {
      "title": "Chris Voss Negotiation Masterclass",
      "url": "https://www.masterclass.com/classes/chris-voss-teaches-the-art-of-negotiation",
      "description": "Masterclass by former FBI negotiator on the art of negotiation"
    },
    {
      "title": "aura",
      "url": "https://get-aura.com",
      "description": "Autonomous HR platform built by the podcast guests"
    }
  ],
  "fullTranscript": "00;00;00;00 - 00;00;18;23\nUnknown\nHello, everybody. And welcome back to another episode of Founder Facing. It's a little bit different this time because we have an extra face on screen. We're doing a dual co-founder interview episode and I'm so lucky to be joined by Gautam Madon. And a perfect goal from aura. How are you doing, guys?\n\n[Full transcript content would continue here...]"
}